{
  "schema_version": "1.0",
  "target": "AGENTS.md",
  "before_tokens": 686,
  "after_tokens": 690,
  "budget_tokens": 1200,
  "human_review_required": true,
  "source_of_truth_writeback": false,
  "edits": [
    {
      "id": "clarify-progressive-disclosure",
      "operation": "modify",
      "target_rule_id": "progressive-disclosure",
      "reason": "Two independent sessions loaded broad repository guidance before identifying the specific information gap.",
      "replacement_text": "Start from the task and minimal relevant context. Pull additional knowledge, evidence, Skills, Loops, Domain guidance, or capabilities only when uncertainty or the work requires them.",
      "evidence_session_ids": ["session-example-001", "session-example-002"]
    }
  ]
}
